"No.","Time","Source","Destination","Protocol","Length","Info"
"798","1.889068","10.0.0.159","142.250.82.213","STUN","162","Binding Request user: Ns1pmoW1ddaczgoKAAiKYigCIAEQ:V/VK"
"811","1.917924","142.250.82.213","10.0.0.159","STUN","106","Binding Success Response XOR-MAPPED-ADDRESS: 69.248.132.39:63450"
"1106","2.694590","10.0.0.159","18.164.124.4","TCP","66","55766  >  443 [SYN] Seq=0 Win=64240 Len=0 MSS=1460 WS=256 SACK_PERM"
"1117","2.721111","18.164.124.4","10.0.0.159","TCP","66","443  >  55766 [SYN, ACK] Seq=0 Ack=1 Win=65535 Len=0 MSS=1440 SACK_PERM WS=512"
"1118","2.721184","10.0.0.159","18.164.124.4","TCP","54","55766  >  443 [ACK] Seq=1 Ack=1 Win=66048 Len=0"
"1124","2.735825","10.0.0.159","18.164.124.4","TLSv1.2","302","Client Hello (SNI=beam.scs.splunk.com)"
"1140","2.760901","18.164.124.4","10.0.0.159","TCP","60","443  >  55766 [ACK] Seq=1 Ack=249 Win=67072 Len=0"
"1141","2.762292","18.164.124.4","10.0.0.159","TLSv1.2","1494","Server Hello"
"1142","2.762894","18.164.124.4","10.0.0.159","TCP","1494","443  >  55766 [PSH, ACK] Seq=1441 Ack=249 Win=67072 Len=1440 [TCP segment of a reassembled PDU]"
"1143","2.762941","10.0.0.159","18.164.124.4","TCP","54","55766  >  443 [ACK] Seq=249 Ack=2881 Win=66048 Len=0"
"1145","2.763863","18.164.124.4","10.0.0.159","TCP","1494","443  >  55766 [ACK] Seq=2881 Ack=249 Win=67072 Len=1440 [TCP segment of a reassembled PDU]"
"1146","2.764442","18.164.124.4","10.0.0.159","TLSv1.2","1151","Certificate, Server Key Exchange, Server Hello Done"
"1147","2.764471","10.0.0.159","18.164.124.4","TCP","54","55766  >  443 [ACK] Seq=249 Ack=5418 Win=66048 Len=0"
"1148","2.765389","10.0.0.159","18.164.124.4","TLSv1.2","180","Client Key Exchange, Change Cipher Spec, Encrypted Handshake Message"
"1158","2.790157","18.164.124.4","10.0.0.159","TCP","60","443  >  55766 [ACK] Seq=5418 Ack=375 Win=67072 Len=0"
"1159","2.790157","18.164.124.4","10.0.0.159","TLSv1.2","105","Change Cipher Spec, Encrypted Handshake Message"
"1160","2.790728","10.0.0.159","18.164.124.4","TLSv1.2","344","Application Data"
"1179","2.822392","18.164.124.4","10.0.0.159","TLSv1.2","746","Application Data"
"1180","2.824154","10.0.0.159","18.164.124.4","TCP","54","55766  >  443 [FIN, ACK] Seq=665 Ack=6161 Win=65280 Len=0"
"1193","2.865218","18.164.124.4","10.0.0.159","TCP","60","443  >  55766 [FIN, ACK] Seq=6161 Ack=666 Win=68096 Len=0"
"1194","2.865305","10.0.0.159","18.164.124.4","TCP","54","55766  >  443 [ACK] Seq=666 Ack=6162 Win=65280 Len=0"
"1475","3.504553","10.0.0.159","239.255.255.250","SSDP","143","M-SEARCH * HTTP/1.1 "
"1476","3.508194","10.0.0.159","10.0.0.1","TCP","66","55780  >  49152 [SYN] Seq=0 Win=64240 Len=0 MSS=1460 WS=256 SACK_PERM"
"1478","3.511893","10.0.0.1","10.0.0.159","TCP","66","49152  >  55780 [SYN, ACK] Seq=0 Ack=1 Win=64240 Len=0 MSS=1460 SACK_PERM WS=128"
"1479","3.511979","10.0.0.159","10.0.0.1","TCP","54","55780  >  49152 [ACK] Seq=1 Ack=1 Win=65536 Len=0"
"1480","3.512100","10.0.0.159","10.0.0.1","HTTP","260","GET /IGDdevicedesc_brlan0.xml HTTP/1.1 "
"1482","3.513876","10.0.0.1","10.0.0.159","UDP","477","36607  >  65355 Len=435"
"1483","3.514749","10.0.0.1","10.0.0.159","TCP","60","49152  >  55780 [ACK] Seq=1 Ack=207 Win=64128 Len=0"
"1484","3.514941","10.0.0.1","10.0.0.159","TCP","326","49152  >  55780 [PSH, ACK] Seq=1 Ack=207 Win=64128 Len=272 [TCP segment of a reassembled PDU]"
"1485","3.516037","10.0.0.1","10.0.0.159","TCP","1514","49152  >  55780 [ACK] Seq=273 Ack=207 Win=64128 Len=1460 [TCP segment of a reassembled PDU]"
"1486","3.516037","10.0.0.1","10.0.0.159","TCP","1514","49152  >  55780 [PSH, ACK] Seq=1733 Ack=207 Win=64128 Len=1460 [TCP segment of a reassembled PDU]"
"1487","3.516037","10.0.0.1","10.0.0.159","HTTP/XML","105","HTTP/1.1 200 OK "
"1488","3.516139","10.0.0.159","10.0.0.1","TCP","54","55780  >  49152 [ACK] Seq=207 Ack=3245 Win=65536 Len=0"
"1489","3.526009","10.0.0.159","10.0.0.1","TCP","54","55780  >  49152 [FIN, ACK] Seq=207 Ack=3245 Win=65536 Len=0"
"1495","3.531412","10.0.0.1","10.0.0.159","TCP","60","49152  >  55780 [ACK] Seq=3245 Ack=208 Win=64128 Len=0"
"1499","3.547215","10.0.0.159","10.0.0.89","TCP","66","55789  >  9080 [SYN] Seq=0 Win=64240 Len=0 MSS=1460 WS=256 SACK_PERM"
"1541","3.615518","10.0.0.89","10.0.0.159","TCP","66","9080  >  55789 [SYN, ACK] Seq=0 Ack=1 Win=65535 Len=0 MSS=1460 SACK_PERM WS=64"
"1542","3.615662","10.0.0.159","10.0.0.89","TCP","54","55789  >  9080 [ACK] Seq=1 Ack=1 Win=65536 Len=0"
"1543","3.616021","10.0.0.159","10.0.0.89","HTTP","236","GET / HTTP/1.1 "
"1545","3.628137","10.0.0.89","10.0.0.159","TCP","60","9080  >  55789 [ACK] Seq=1 Ack=183 Win=87616 Len=0"
"1546","3.628137","10.0.0.89","10.0.0.159","TCP","198","9080  >  55789 [PSH, ACK] Seq=1 Ack=183 Win=87616 Len=144 [TCP segment of a reassembled PDU]"
"1547","3.628137","10.0.0.89","10.0.0.159","HTTP","63","HTTP/1.1 200 OK "
"1548","3.628313","10.0.0.159","10.0.0.89","TCP","54","55789  >  9080 [ACK] Seq=183 Ack=155 Win=65536 Len=0"
"1549","3.630044","10.0.0.159","10.0.0.89","TCP","54","55789  >  9080 [FIN, ACK] Seq=183 Ack=155 Win=65536 Len=0"
"1551","3.634049","10.0.0.89","10.0.0.159","TCP","60","9080  >  55789 [ACK] Seq=155 Ack=184 Win=87616 Len=0"
"1620","3.781534","10.0.0.89","10.0.0.159","UDP","753","45851  >  65355 Len=711"
"2666","6.505173","10.0.0.159","239.255.255.250","SSDP","143","M-SEARCH * HTTP/1.1 "
"2689","6.531262","10.0.0.1","10.0.0.159","UDP","477","48826  >  65355 Len=435"
"2783","6.786225","10.0.0.89","10.0.0.159","UDP","753","42457  >  65355 Len=711"
"3811","9.505326","10.0.0.159","239.255.255.250","SSDP","143","M-SEARCH * HTTP/1.1 "
"3812","9.511591","10.0.0.1","10.0.0.159","UDP","477","34874  >  65355 Len=435"
"3911","9.806566","10.0.0.89","10.0.0.159","UDP","753","60905  >  65355 Len=711"
"4015","10.122881","10.0.0.159","142.250.82.217","STUN","162","Binding Request user: umaTqEcejf817QoKAAiKYigCIAEQ:bSLo"
"4025","10.157018","142.250.82.217","10.0.0.159","STUN","106","Binding Success Response XOR-MAPPED-ADDRESS: 69.248.132.39:63497"
"4406","11.261749","10.0.0.159","239.255.255.250","SSDP","217","M-SEARCH * HTTP/1.1 "
"4420","11.293814","10.0.0.89","10.0.0.159","SSDP","376","HTTP/1.1 200 OK "
"4596","11.858461","10.0.0.159","34.237.73.95","TLSv1.2","293","Application Data"
"4626","11.887734","34.237.73.95","10.0.0.159","TLSv1.2","318","Application Data"
"4650","11.928886","10.0.0.159","34.237.73.95","TCP","54","51102  >  443 [ACK] Seq=240 Ack=265 Win=513 Len=0"
"4699","12.103785","10.0.0.159","192.229.211.108","TCP","54","50497  >  80 [FIN, ACK] Seq=1 Ack=1 Win=510 Len=0"
"4783","12.262912","10.0.0.159","239.255.255.250","SSDP","217","M-SEARCH * HTTP/1.1 "
"4818","12.320762","10.0.0.89","10.0.0.159","SSDP","376","HTTP/1.1 200 OK "
"4854","12.405514","10.0.0.159","192.229.211.108","TCP","54","[TCP Retransmission] 50497  >  80 [FIN, ACK] Seq=1 Ack=1 Win=510 Len=0"
"4962","12.765150","34.237.73.95","10.0.0.159","TLSv1.2","78","Application Data"
"4963","12.766595","10.0.0.159","34.237.73.95","TLSv1.2","82","Application Data"
"4991","12.842230","34.237.73.95","10.0.0.159","TCP","60","443  >  51102 [ACK] Seq=289 Ack=268 Win=398 Len=0"
"5058","13.005710","10.0.0.159","192.229.211.108","TCP","54","[TCP Retransmission] 50497  >  80 [FIN, ACK] Seq=1 Ack=1 Win=510 Len=0"
"5226","13.263970","10.0.0.159","239.255.255.250","SSDP","217","M-SEARCH * HTTP/1.1 "
"5246","13.344337","10.0.0.89","10.0.0.159","SSDP","376","HTTP/1.1 200 OK "
"5352","13.576495","10.0.0.159","239.255.255.250","SSDP","143","M-SEARCH * HTTP/1.1 "
"5353","13.581387","10.0.0.159","10.0.0.1","TCP","66","55807  >  49152 [SYN] Seq=0 Win=64240 Len=0 MSS=1460 WS=256 SACK_PERM"
"5354","13.585878","10.0.0.1","10.0.0.159","TCP","66","49152  >  55807 [SYN, ACK] Seq=0 Ack=1 Win=64240 Len=0 MSS=1460 SACK_PERM WS=128"
"5355","13.586088","10.0.0.159","10.0.0.1","TCP","54","55807  >  49152 [ACK] Seq=1 Ack=1 Win=65536 Len=0"
"5356","13.586246","10.0.0.159","10.0.0.1","HTTP","260","GET /IGDdevicedesc_brlan0.xml HTTP/1.1 "
"5358","13.589898","10.0.0.1","10.0.0.159","TCP","60","49152  >  55807 [ACK] Seq=1 Ack=207 Win=64128 Len=0"
"5361","13.593044","10.0.0.1","10.0.0.159","TCP","326","49152  >  55807 [PSH, ACK] Seq=1 Ack=207 Win=64128 Len=272 [TCP segment of a reassembled PDU]"
"5362","13.595216","10.0.0.1","10.0.0.159","TCP","1514","49152  >  55807 [ACK] Seq=273 Ack=207 Win=64128 Len=1460 [TCP segment of a reassembled PDU]"
"5363","13.595216","10.0.0.1","10.0.0.159","TCP","1514","49152  >  55807 [PSH, ACK] Seq=1733 Ack=207 Win=64128 Len=1460 [TCP segment of a reassembled PDU]"
"5364","13.595216","10.0.0.1","10.0.0.159","HTTP/XML","105","HTTP/1.1 200 OK "
"5365","13.595310","10.0.0.159","10.0.0.1","TCP","54","55807  >  49152 [ACK] Seq=207 Ack=3245 Win=65536 Len=0"
"5378","13.607969","10.0.0.159","10.0.0.1","TCP","54","55807  >  49152 [FIN, ACK] Seq=207 Ack=3245 Win=65536 Len=0"
"5379","13.613112","10.0.0.1","10.0.0.159","TCP","60","49152  >  55807 [ACK] Seq=3245 Ack=208 Win=64128 Len=0"
"5381","13.619469","10.0.0.159","10.0.0.89","TCP","66","55808  >  9080 [SYN] Seq=0 Win=64240 Len=0 MSS=1460 WS=256 SACK_PERM"
"5388","13.652294","10.0.0.89","10.0.0.159","TCP","66","9080  >  55808 [SYN, ACK] Seq=0 Ack=1 Win=65535 Len=0 MSS=1460 SACK_PERM WS=64"
"5389","13.652382","10.0.0.159","10.0.0.89","TCP","54","55808  >  9080 [ACK] Seq=1 Ack=1 Win=65536 Len=0"
"5392","13.652506","10.0.0.159","10.0.0.89","HTTP","236","GET / HTTP/1.1 "
"5394","13.656837","10.0.0.89","10.0.0.159","TCP","60","9080  >  55808 [ACK] Seq=1 Ack=183 Win=87616 Len=0"
"5395","13.657033","10.0.0.89","10.0.0.159","TCP","198","9080  >  55808 [PSH, ACK] Seq=1 Ack=183 Win=87616 Len=144 [TCP segment of a reassembled PDU]"
"5396","13.657469","10.0.0.89","10.0.0.159","HTTP","63","HTTP/1.1 200 OK "
"5397","13.657568","10.0.0.159","10.0.0.89","TCP","54","55808  >  9080 [ACK] Seq=183 Ack=155 Win=65536 Len=0"
"5398","13.658177","10.0.0.159","10.0.0.89","TCP","54","55808  >  9080 [FIN, ACK] Seq=183 Ack=155 Win=65536 Len=0"
"5399","13.660831","10.0.0.89","10.0.0.159","TCP","60","9080  >  55808 [ACK] Seq=155 Ack=184 Win=87616 Len=0"
"5429","13.721228","10.0.0.1","10.0.0.159","UDP","477","56027  >  65355 Len=435"
"5439","13.784963","10.0.0.89","10.0.0.159","UDP","753","37142  >  65355 Len=711"
"5612","14.124574","10.0.0.159","13.89.179.9","TCP","66","55809  >  443 [SYN] Seq=0 Win=65535 Len=0 MSS=1460 WS=256 SACK_PERM"
"5626","14.190910","13.89.179.9","10.0.0.159","TCP","66","443  >  55809 [SYN, ACK] Seq=0 Ack=1 Win=65535 Len=0 MSS=1440 WS=256 SACK_PERM"
"5627","14.191279","10.0.0.159","13.89.179.9","TCP","54","55809  >  443 [ACK] Seq=1 Ack=1 Win=262144 Len=0"
"5628","14.192505","10.0.0.159","13.89.179.9","TLSv1.2","270","Client Hello (SNI=browser.pipe.aria.microsoft.com)"
"5646","14.207079","10.0.0.159","192.229.211.108","TCP","54","[TCP Retransmission] 50497  >  80 [FIN, ACK] Seq=1 Ack=1 Win=510 Len=0"
"5671","14.251302","13.89.179.9","10.0.0.159","TCP","60","443  >  55809 [ACK] Seq=1 Ack=217 Win=4194304 Len=0"
"5672","14.252412","13.89.179.9","10.0.0.159","TCP","1514","443  >  55809 [ACK] Seq=1 Ack=217 Win=4194304 Len=1460 [TCP segment of a reassembled PDU]"
"5673","14.252490","10.0.0.159","13.89.179.9","TCP","54","55809  >  443 [ACK] Seq=217 Ack=1461 Win=262144 Len=0"
"5674","14.253131","13.89.179.9","10.0.0.159","TCP","1514","443  >  55809 [ACK] Seq=1461 Ack=217 Win=4194304 Len=1460 [TCP segment of a reassembled PDU]"
"5675","14.253131","13.89.179.9","10.0.0.159","TCP","1514","443  >  55809 [ACK] Seq=2921 Ack=217 Win=4194304 Len=1460 [TCP segment of a reassembled PDU]"
"5676","14.253131","13.89.179.9","10.0.0.159","TCP","1514","443  >  55809 [ACK] Seq=4381 Ack=217 Win=4194304 Len=1460 [TCP segment of a reassembled PDU]"
"5677","14.253131","13.89.179.9","10.0.0.159","TLSv1.2","466","Server Hello, Certificate, Certificate Status, Server Key Exchange, Server Hello Done"
"5678","14.253216","10.0.0.159","13.89.179.9","TCP","54","55809  >  443 [ACK] Seq=217 Ack=6253 Win=262144 Len=0"
"5679","14.261459","10.0.0.159","13.89.179.9","TLSv1.2","212","Client Key Exchange, Change Cipher Spec, Encrypted Handshake Message"
"5698","14.265355","10.0.0.159","239.255.255.250","SSDP","217","M-SEARCH * HTTP/1.1 "
"5710","14.324267","13.89.179.9","10.0.0.159","TLSv1.2","105","Change Cipher Spec, Encrypted Handshake Message"
"5711","14.324337","10.0.0.159","13.89.179.9","TCP","54","55809  >  443 [ACK] Seq=375 Ack=6304 Win=261888 Len=0"
"5712","14.324686","13.89.179.9","10.0.0.159","TLSv1.2","123","Application Data"
"5713","14.324757","10.0.0.159","13.89.179.9","TCP","54","55809  >  443 [ACK] Seq=375 Ack=6373 Win=261888 Len=0"
"5714","14.325059","10.0.0.159","13.89.179.9","TLSv1.2","141","Application Data"
"5715","14.325133","10.0.0.159","13.89.179.9","TLSv1.2","92","Application Data"
"5716","14.325199","10.0.0.159","13.89.179.9","TLSv1.2","513","Application Data"
"5721","14.325507","10.0.0.159","13.89.179.9","TCP","1494","55809  >  443 [ACK] Seq=959 Ack=6373 Win=261888 Len=1440 [TCP segment of a reassembled PDU]"
"5722","14.325507","10.0.0.159","13.89.179.9","TLSv1.2","849","Application Data"
"5725","14.325749","10.0.0.159","13.89.179.9","TLSv1.2","92","Application Data"
"5743","14.367280","10.0.0.89","10.0.0.159","SSDP","376","HTTP/1.1 200 OK "
"5746","14.397264","13.89.179.9","10.0.0.159","TCP","60","443  >  55809 [ACK] Seq=6373 Ack=959 Win=4193536 Len=0"
"5747","14.397264","13.89.179.9","10.0.0.159","TCP","60","443  >  55809 [ACK] Seq=6373 Ack=3232 Win=4194560 Len=0"
"5748","14.397264","13.89.179.9","10.0.0.159","TLSv1.2","92","Application Data"
"5749","14.397675","10.0.0.159","13.89.179.9","TCP","54","55809  >  443 [ACK] Seq=3232 Ack=6411 Win=261888 Len=0"
"5765","14.453496","13.89.179.9","10.0.0.159","TLSv1.2","346","Application Data"
"5766","14.454070","10.0.0.159","13.89.179.9","TCP","54","55809  >  443 [ACK] Seq=3232 Ack=6703 Win=261632 Len=0"
"6108","15.721122","10.0.0.159","204.79.197.222","TCP","66","55818  >  443 [SYN] Seq=0 Win=65535 Len=0 MSS=1460 WS=256 SACK_PERM"
"6115","15.748014","204.79.197.222","10.0.0.159","TCP","66","443  >  55818 [SYN, ACK] Seq=0 Ack=1 Win=65535 Len=0 MSS=1440 WS=256 SACK_PERM"
"6116","15.748128","10.0.0.159","204.79.197.222","TCP","54","55818  >  443 [ACK] Seq=1 Ack=1 Win=262144 Len=0"
"6117","15.748503","10.0.0.159","204.79.197.222","TLSv1.2","560","Client Hello (SNI=fp.msedge.net)"
"6147","15.770148","204.79.197.222","10.0.0.159","TCP","60","443  >  55818 [ACK] Seq=1 Ack=507 Win=4194048 Len=0"
"6148","15.770623","204.79.197.222","10.0.0.159","TCP","1514","443  >  55818 [ACK] Seq=1 Ack=507 Win=4194048 Len=1460 [TCP segment of a reassembled PDU]"
"6149","15.770678","10.0.0.159","204.79.197.222","TCP","54","55818  >  443 [ACK] Seq=507 Ack=1461 Win=262144 Len=0"
"6150","15.771537","204.79.197.222","10.0.0.159","TCP","1514","443  >  55818 [ACK] Seq=1461 Ack=507 Win=4194048 Len=1460 [TCP segment of a reassembled PDU]"
"6151","15.771537","204.79.197.222","10.0.0.159","TCP","1514","443  >  55818 [ACK] Seq=2921 Ack=507 Win=4194048 Len=1460 [TCP segment of a reassembled PDU]"
"6152","15.771622","10.0.0.159","204.79.197.222","TCP","54","55818  >  443 [ACK] Seq=507 Ack=4381 Win=262144 Len=0"
"6153","15.771956","204.79.197.222","10.0.0.159","TCP","1514","443  >  55818 [ACK] Seq=4381 Ack=507 Win=4194048 Len=1460 [TCP segment of a reassembled PDU]"
"6154","15.771999","10.0.0.159","204.79.197.222","TCP","54","55818  >  443 [ACK] Seq=507 Ack=5841 Win=262144 Len=0"
"6155","15.772091","204.79.197.222","10.0.0.159","TLSv1.2","419","Server Hello, Certificate, Certificate Status, Server Key Exchange, Server Hello Done"
"6156","15.772126","10.0.0.159","204.79.197.222","TCP","54","55818  >  443 [ACK] Seq=507 Ack=6206 Win=261632 Len=0"
"6158","15.778376","10.0.0.159","204.79.197.222","TLSv1.2","212","Client Key Exchange, Change Cipher Spec, Encrypted Handshake Message"
"6159","15.778986","10.0.0.159","204.79.197.222","TLSv1.2","141","Application Data"
"6160","15.779096","10.0.0.159","204.79.197.222","TLSv1.2","373","Application Data"
"6169","15.800368","204.79.197.222","10.0.0.159","TCP","60","443  >  55818 [ACK] Seq=6206 Ack=1071 Win=4193280 Len=0"
"6170","15.802886","204.79.197.222","10.0.0.159","TLSv1.2","396","New Session Ticket, Change Cipher Spec, Encrypted Handshake Message"
"6171","15.802886","204.79.197.222","10.0.0.159","TLSv1.2","123","Application Data"
"6172","15.803087","10.0.0.159","204.79.197.222","TCP","54","55818  >  443 [ACK] Seq=1071 Ack=6617 Win=261120 Len=0"
"6173","15.803666","10.0.0.159","204.79.197.222","TLSv1.2","92","Application Data"
"6177","15.813274","204.79.197.222","10.0.0.159","TLSv1.2","1514","Application Data"
"6178","15.813274","204.79.197.222","10.0.0.159","TCP","1514","443  >  55818 [ACK] Seq=8077 Ack=1071 Win=4193280 Len=1460 [TCP segment of a reassembled PDU]"
"6179","15.813274","204.79.197.222","10.0.0.159","TLSv1.2","1204","Application Data"
"6180","15.813274","204.79.197.222","10.0.0.159","TLSv1.2","140","Application Data"
"6181","15.813274","204.79.197.222","10.0.0.159","TCP","1514","443  >  55818 [ACK] Seq=10773 Ack=1071 Win=4193280 Len=1460 [TCP segment of a reassembled PDU]"
"6182","15.813443","10.0.0.159","204.79.197.222","TCP","54","55818  >  443 [ACK] Seq=1109 Ack=12233 Win=262144 Len=0"
"6183","15.818051","204.79.197.222","10.0.0.159","TCP","1514","443  >  55818 [ACK] Seq=12233 Ack=1071 Win=4193280 Len=1460 [TCP segment of a reassembled PDU]"
"6184","15.818051","204.79.197.222","10.0.0.159","TLSv1.2","1268","Application Data"
"6185","15.818051","204.79.197.222","10.0.0.159","TCP","1514","443  >  55818 [ACK] Seq=14907 Ack=1071 Win=4193280 Len=1460 [TCP segment of a reassembled PDU]"
"6186","15.818051","204.79.197.222","10.0.0.159","TCP","1514","443  >  55818 [ACK] Seq=16367 Ack=1071 Win=4193280 Len=1460 [TCP segment of a reassembled PDU]"
"6187","15.818051","204.79.197.222","10.0.0.159","TLSv1.2","1268","Application Data"
"6188","15.818256","10.0.0.159","204.79.197.222","TCP","54","55818  >  443 [ACK] Seq=1109 Ack=19041 Win=262144 Len=0"
"6189","15.821594","204.79.197.222","10.0.0.159","TCP","1514","443  >  55818 [ACK] Seq=19041 Ack=1071 Win=4193280 Len=1460 [TCP segment of a reassembled PDU]"
"6190","15.821594","204.79.197.222","10.0.0.159","TCP","1514","443  >  55818 [ACK] Seq=20501 Ack=1071 Win=4193280 Len=1460 [TCP segment of a reassembled PDU]"
"6191","15.821594","204.79.197.222","10.0.0.159","TLSv1.2","1268","Application Data"
"6192","15.821594","204.79.197.222","10.0.0.159","TCP","1514","443  >  55818 [ACK] Seq=23175 Ack=1071 Win=4193280 Len=1460 [TCP segment of a reassembled PDU]"
"6193","15.821594","204.79.197.222","10.0.0.159","TCP","1514","443  >  55818 [ACK] Seq=24635 Ack=1071 Win=4193280 Len=1460 [TCP segment of a reassembled PDU]"
"6194","15.821594","204.79.197.222","10.0.0.159","TLSv1.2","654","Application Data"
"6195","15.821594","204.79.197.222","10.0.0.159","TLSv1.2","92","Application Data"
"6196","15.821735","10.0.0.159","204.79.197.222","TCP","54","55818  >  443 [ACK] Seq=1109 Ack=26733 Win=262144 Len=0"
"6200","15.847379","204.79.197.222","10.0.0.159","TCP","60","443  >  55818 [ACK] Seq=26733 Ack=1109 Win=4193280 Len=0"
"6471","16.576434","10.0.0.159","239.255.255.250","SSDP","143","M-SEARCH * HTTP/1.1 "
"6473","16.586102","10.0.0.1","10.0.0.159","UDP","477","38175  >  65355 Len=435"
"6484","16.608891","10.0.0.159","192.229.211.108","TCP","54","[TCP Retransmission] 50497  >  80 [FIN, ACK] Seq=1 Ack=1 Win=510 Len=0"
"6492","16.647089","10.0.0.89","10.0.0.159","UDP","753","42720  >  65355 Len=711"
"7113","18.264663","10.0.0.159","75.75.75.75","DNS","91","Standard query 0x0ee6 AAAA signaler-pa.clients6.google.com"
"7116","18.265256","10.0.0.159","75.75.75.75","DNS","91","Standard query 0xcc9f A signaler-pa.clients6.google.com"
"7117","18.265687","10.0.0.159","75.75.75.75","DNS","91","Standard query 0x08d8 HTTPS signaler-pa.clients6.google.com"
"7129","18.291059","75.75.75.75","10.0.0.159","DNS","119","Standard query response 0x0ee6 AAAA signaler-pa.clients6.google.com AAAA 2607:f8b0:4006:824::200a"
"7136","18.299286","75.75.75.75","10.0.0.159","DNS","141","Standard query response 0x08d8 HTTPS signaler-pa.clients6.google.com SOA ns1.google.com"
"7139","18.303596","75.75.75.75","10.0.0.159","DNS","107","Standard query response 0xcc9f A signaler-pa.clients6.google.com A 142.250.80.106"
"7193","18.376491","10.0.0.159","204.79.197.222","TLSv1.2","720","Application Data"
"7210","18.406171","204.79.197.222","10.0.0.159","TCP","60","443  >  55818 [ACK] Seq=26733 Ack=1775 Win=4194560 Len=0"
"7211","18.406171","204.79.197.222","10.0.0.159","TLSv1.2","239","Application Data"
"7212","18.406171","204.79.197.222","10.0.0.159","TLSv1.2","92","Application Data"
"7213","18.406565","10.0.0.159","204.79.197.222","TCP","54","55818  >  443 [ACK] Seq=1775 Ack=26956 Win=261888 Len=0"
"7398","18.918456","10.0.0.159","18.164.124.4","TCP","66","55866  >  443 [SYN] Seq=0 Win=64240 Len=0 MSS=1460 WS=256 SACK_PERM"
"7400","18.937286","18.164.124.4","10.0.0.159","TCP","66","443  >  55866 [SYN, ACK] Seq=0 Ack=1 Win=65535 Len=0 MSS=1440 SACK_PERM WS=512"
"7401","18.937488","10.0.0.159","18.164.124.4","TCP","54","55866  >  443 [ACK] Seq=1 Ack=1 Win=66048 Len=0"
"7418","18.953526","10.0.0.159","18.164.124.4","TLSv1.2","302","Client Hello (SNI=beam.scs.splunk.com)"
"7435","18.979008","18.164.124.4","10.0.0.159","TCP","60","443  >  55866 [ACK] Seq=1 Ack=249 Win=67072 Len=0"
"7436","18.979965","18.164.124.4","10.0.0.159","TLSv1.2","1494","Server Hello"
"7437","18.979965","18.164.124.4","10.0.0.159","TCP","1494","443  >  55866 [PSH, ACK] Seq=1441 Ack=249 Win=67072 Len=1440 [TCP segment of a reassembled PDU]"
"7438","18.980013","10.0.0.159","18.164.124.4","TCP","54","55866  >  443 [ACK] Seq=249 Ack=2881 Win=66048 Len=0"
"7439","18.980984","18.164.124.4","10.0.0.159","TCP","1494","443  >  55866 [ACK] Seq=2881 Ack=249 Win=67072 Len=1440 [TCP segment of a reassembled PDU]"
"7440","18.980984","18.164.124.4","10.0.0.159","TLSv1.2","1151","Certificate, Server Key Exchange, Server Hello Done"
"7441","18.981052","10.0.0.159","18.164.124.4","TCP","54","55866  >  443 [ACK] Seq=249 Ack=5418 Win=66048 Len=0"
"7443","18.983686","10.0.0.159","18.164.124.4","TLSv1.2","180","Client Key Exchange, Change Cipher Spec, Encrypted Handshake Message"
"7453","19.006494","18.164.124.4","10.0.0.159","TCP","60","443  >  55866 [ACK] Seq=5418 Ack=375 Win=67072 Len=0"
"7454","19.006494","18.164.124.4","10.0.0.159","TLSv1.2","105","Change Cipher Spec, Encrypted Handshake Message"
"7456","19.007517","10.0.0.159","18.164.124.4","TLSv1.2","344","Application Data"
"7483","19.045174","18.164.124.4","10.0.0.159","TLSv1.2","746","Application Data"
"7484","19.046171","10.0.0.159","18.164.124.4","TCP","54","55866  >  443 [FIN, ACK] Seq=665 Ack=6161 Win=65280 Len=0"
"7503","19.078351","18.164.124.4","10.0.0.159","TCP","60","443  >  55866 [FIN, ACK] Seq=6161 Ack=666 Win=68096 Len=0"
"7504","19.078453","10.0.0.159","18.164.124.4","TCP","54","55866  >  443 [ACK] Seq=666 Ack=6162 Win=65280 Len=0"
"7682","19.577346","10.0.0.159","239.255.255.250","SSDP","143","M-SEARCH * HTTP/1.1 "
"7684","19.582569","10.0.0.1","10.0.0.159","UDP","477","35930  >  65355 Len=435"
"7746","19.792252","10.0.0.89","10.0.0.159","UDP","753","32809  >  65355 Len=711"
"8138","21.412042","10.0.0.159","192.229.211.108","TCP","54","[TCP Retransmission] 50497  >  80 [FIN, ACK] Seq=1 Ack=1 Win=510 Len=0"
"8437","23.112128","10.0.0.159","75.75.75.75","DNS","75","Standard query 0x4397 AAAA play.google.com"
"8438","23.112552","10.0.0.159","75.75.75.75","DNS","75","Standard query 0x296c A play.google.com"
"8439","23.112833","10.0.0.159","75.75.75.75","DNS","75","Standard query 0x4be7 HTTPS play.google.com"
"8473","23.149520","75.75.75.75","10.0.0.159","DNS","91","Standard query response 0x296c A play.google.com A 142.250.80.46"
"8474","23.150464","75.75.75.75","10.0.0.159","DNS","103","Standard query response 0x4397 AAAA play.google.com AAAA 2607:f8b0:4006:820::200e"
"8477","23.152154","75.75.75.75","10.0.0.159","DNS","125","Standard query response 0x4be7 HTTPS play.google.com SOA ns1.google.com"
"8628","23.594907","10.0.0.159","224.0.0.251","MDNS","119","Standard query 0x0000 PTR _apple-mobdev._tcp.local, ""QM"" question PTR 4d2b0580._sub._apple-mobdev2._tcp.local, ""QM"" question"
"8629","23.601745","10.0.0.159","239.255.255.250","SSDP","143","M-SEARCH * HTTP/1.1 "
"8630","23.605316","10.0.0.159","10.0.0.1","TCP","66","55888  >  49152 [SYN] Seq=0 Win=64240 Len=0 MSS=1460 WS=256 SACK_PERM"
"8633","23.627576","10.0.0.1","10.0.0.159","TCP","66","49152  >  55888 [SYN, ACK] Seq=0 Ack=1 Win=64240 Len=0 MSS=1460 SACK_PERM WS=128"
"8634","23.627643","10.0.0.159","10.0.0.1","TCP","54","55888  >  49152 [ACK] Seq=1 Ack=1 Win=131328 Len=0"
"8635","23.627747","10.0.0.159","10.0.0.1","HTTP","260","GET /IGDdevicedesc_brlan0.xml HTTP/1.1 "
"8636","23.630561","10.0.0.1","10.0.0.159","TCP","60","49152  >  55888 [ACK] Seq=1 Ack=207 Win=64128 Len=0"
"8637","23.631755","10.0.0.1","10.0.0.159","TCP","326","49152  >  55888 [PSH, ACK] Seq=1 Ack=207 Win=64128 Len=272 [TCP segment of a reassembled PDU]"
"8638","23.632305","10.0.0.1","10.0.0.159","TCP","1514","49152  >  55888 [ACK] Seq=273 Ack=207 Win=64128 Len=1460 [TCP segment of a reassembled PDU]"
"8639","23.632348","10.0.0.159","10.0.0.1","TCP","54","55888  >  49152 [ACK] Seq=207 Ack=1733 Win=131328 Len=0"
"8640","23.632930","10.0.0.1","10.0.0.159","TCP","1514","49152  >  55888 [PSH, ACK] Seq=1733 Ack=207 Win=64128 Len=1460 [TCP segment of a reassembled PDU]"
"8641","23.632930","10.0.0.1","10.0.0.159","HTTP/XML","105","HTTP/1.1 200 OK "
"8642","23.632974","10.0.0.159","10.0.0.1","TCP","54","55888  >  49152 [ACK] Seq=207 Ack=3245 Win=131328 Len=0"
"8643","23.634155","10.0.0.159","10.0.0.1","TCP","54","55888  >  49152 [FIN, ACK] Seq=207 Ack=3245 Win=131328 Len=0"
"8644","23.637054","10.0.0.1","10.0.0.159","TCP","60","49152  >  55888 [ACK] Seq=3245 Ack=208 Win=64128 Len=0"
"8646","23.645886","10.0.0.159","10.0.0.89","TCP","66","55897  >  9080 [SYN] Seq=0 Win=64240 Len=0 MSS=1460 WS=256 SACK_PERM"
"8654","23.685447","10.0.0.89","10.0.0.159","TCP","66","9080  >  55897 [SYN, ACK] Seq=0 Ack=1 Win=65535 Len=0 MSS=1460 SACK_PERM WS=64"
"8655","23.685566","10.0.0.159","10.0.0.89","TCP","54","55897  >  9080 [ACK] Seq=1 Ack=1 Win=131328 Len=0"
"8656","23.685763","10.0.0.159","10.0.0.89","HTTP","236","GET / HTTP/1.1 "
"8657","23.686117","10.0.0.89","10.0.0.159","UDP","753","35912  >  65355 Len=711"
"8658","23.691330","10.0.0.89","10.0.0.159","TCP","60","9080  >  55897 [ACK] Seq=1 Ack=183 Win=87616 Len=0"
"8659","23.691330","10.0.0.89","10.0.0.159","TCP","198","9080  >  55897 [PSH, ACK] Seq=1 Ack=183 Win=87616 Len=144 [TCP segment of a reassembled PDU]"
"8660","23.691330","10.0.0.89","10.0.0.159","HTTP","63","HTTP/1.1 200 OK "
"8661","23.691547","10.0.0.159","10.0.0.89","TCP","54","55897  >  9080 [ACK] Seq=183 Ack=155 Win=131072 Len=0"
"8662","23.692834","10.0.0.159","10.0.0.89","TCP","54","55897  >  9080 [FIN, ACK] Seq=183 Ack=155 Win=131072 Len=0"
"8664","23.696382","10.0.0.89","10.0.0.159","TCP","60","9080  >  55897 [ACK] Seq=155 Ack=184 Win=87616 Len=0"
"8666","23.715411","10.0.0.1","10.0.0.159","UDP","477","45697  >  65355 Len=435"
"8668","23.719230","10.0.0.159","75.75.75.75","DNS","75","Standard query 0x5fb0 AAAA meet.google.com"
"8669","23.719648","10.0.0.159","75.75.75.75","DNS","75","Standard query 0xddeb A meet.google.com"
"8670","23.719951","10.0.0.159","75.75.75.75","DNS","75","Standard query 0x42f1 HTTPS meet.google.com"
"8673","23.738261","75.75.75.75","10.0.0.159","DNS","103","Standard query response 0x5fb0 AAAA meet.google.com AAAA 2607:f8b0:4006:817::200e"
"8674","23.738852","75.75.75.75","10.0.0.159","DNS","125","Standard query response 0x42f1 HTTPS meet.google.com SOA ns1.google.com"
"8675","23.742138","75.75.75.75","10.0.0.159","DNS","91","Standard query response 0xddeb A meet.google.com A 142.250.80.110"
"8734","23.899949","10.0.0.159","75.75.75.75","DNS","80","Standard query 0x005c AAAA www.interntheory.com"
"8735","23.900237","10.0.0.159","75.75.75.75","DNS","80","Standard query 0x4617 A www.interntheory.com"
"8736","23.900415","10.0.0.159","75.75.75.75","DNS","80","Standard query 0x77da HTTPS www.interntheory.com"
"8759","24.024008","75.75.75.75","10.0.0.159","DNS","112","Standard query response 0x4617 A www.interntheory.com A 104.21.17.235 A 172.67.178.170"
"8760","24.027539","10.0.0.159","75.75.75.75","DNS","76","Standard query 0x2d17 AAAA econnect.bpcl.in"
"8761","24.027807","10.0.0.159","75.75.75.75","DNS","76","Standard query 0x0b74 A econnect.bpcl.in"
"8762","24.027990","10.0.0.159","75.75.75.75","DNS","76","Standard query 0xfe1a HTTPS econnect.bpcl.in"
"8768","24.034929","75.75.75.75","10.0.0.159","DNS","136","Standard query response 0x005c AAAA www.interntheory.com AAAA 2606:4700:3032::ac43:b2aa AAAA 2606:4700:3036::6815:11eb"
"8770","24.037648","75.75.75.75","10.0.0.159","DNS","153","Standard query response 0x77da HTTPS www.interntheory.com HTTPS"
"8771","24.038207","10.0.0.159","75.75.76.76","DNS","80","Standard query 0x3827 HTTPS www.interntheory.com"
"8780","24.044510","10.0.0.159","75.75.75.75","DNS","80","Standard query 0xe9ba AAAA beacons.gcp.gvt2.com"
"8781","24.044823","10.0.0.159","75.75.75.75","DNS","80","Standard query 0x4e45 A beacons.gcp.gvt2.com"
"8782","24.045108","10.0.0.159","75.75.75.75","DNS","80","Standard query 0xf778 HTTPS beacons.gcp.gvt2.com"
"8788","24.066212","75.75.75.75","10.0.0.159","DNS","193","Standard query response 0x0b74 A econnect.bpcl.in CNAME econnect.bpcl.in.induscdn.com CNAME econnect.bpcl.in.indusguard.com A 13.201.244.85 A 43.204.3.183"
"8793","24.072662","75.75.75.75","10.0.0.159","DNS","138","Standard query response 0xe9ba AAAA beacons.gcp.gvt2.com CNAME beacons-handoff.gcp.gvt2.com AAAA 2607:f8b0:4006:80c::2003"
"8794","24.074459","75.75.75.75","10.0.0.159","DNS","126","Standard query response 0x4e45 A beacons.gcp.gvt2.com CNAME beacons-handoff.gcp.gvt2.com A 142.251.40.131"
"8795","24.074908","75.75.75.75","10.0.0.159","DNS","193","Standard query response 0xf778 HTTPS beacons.gcp.gvt2.com CNAME beacons-handoff.gcp.gvt2.com CNAME gce-beacons.gcp.gvt2.com SOA ns1.google.com"
"8797","24.075969","75.75.75.75","10.0.0.159","DNS","243","Standard query response 0x2d17 AAAA econnect.bpcl.in CNAME econnect.bpcl.in.induscdn.com CNAME econnect.bpcl.in.indusguard.com SOA ns-1143.awsdns-14.org"
"8805","24.091959","10.0.0.159","13.201.244.85","TCP","66","55901  >  443 [SYN] Seq=0 Win=64240 Len=0 MSS=1460 WS=256 SACK_PERM"
"8820","24.141779","75.75.75.75","10.0.0.159","DNS","243","Standard query response 0xfe1a HTTPS econnect.bpcl.in CNAME econnect.bpcl.in.induscdn.com CNAME econnect.bpcl.in.indusguard.com SOA ns-1143.awsdns-14.org"
"8838","24.236014","75.75.76.76","10.0.0.159","DNS","153","Standard query response 0x3827 HTTPS www.interntheory.com HTTPS"
"8874","24.358937","13.201.244.85","10.0.0.159","TCP","66","443  >  55901 [SYN, ACK] Seq=0 Ack=1 Win=62727 Len=0 MSS=1460 SACK_PERM WS=1024"
"8875","24.359085","10.0.0.159","13.201.244.85","TCP","54","55901  >  443 [ACK] Seq=1 Ack=1 Win=131328 Len=0"
"8876","24.360717","10.0.0.159","13.201.244.85","TCP","1514","55901  >  443 [ACK] Seq=1 Ack=1 Win=131328 Len=1460 [TCP segment of a reassembled PDU]"
"8877","24.360717","10.0.0.159","13.201.244.85","TLSv1.3","384","Client Hello (SNI=econnect.bpcl.in)"
"8906","24.635642","13.201.244.85","10.0.0.159","TCP","60","443  >  55901 [ACK] Seq=1 Ack=1461 Win=61440 Len=0"
"8907","24.637385","13.201.244.85","10.0.0.159","TCP","60","443  >  55901 [ACK] Seq=1 Ack=1791 Win=61440 Len=0"
"8908","24.637385","13.201.244.85","10.0.0.159","TLSv1.3","1514","Server Hello, Change Cipher Spec, Application Data"
"8909","24.637385","13.201.244.85","10.0.0.159","TCP","1514","443  >  55901 [PSH, ACK] Seq=1461 Ack=1791 Win=61440 Len=1460 [TCP segment of a reassembled PDU]"
"8910","24.637385","13.201.244.85","10.0.0.159","TLSv1.3","1230","Application Data"
"8911","24.637385","13.201.244.85","10.0.0.159","TLSv1.3","280","Application Data, Application Data"
"8912","24.637556","10.0.0.159","13.201.244.85","TCP","54","55901  >  443 [ACK] Seq=1791 Ack=4323 Win=131328 Len=0"
"8913","24.638214","10.0.0.159","13.201.244.85","TLSv1.3","118","Change Cipher Spec, Application Data"
"8950","24.982218","13.201.244.85","10.0.0.159","TCP","60","443  >  55901 [ACK] Seq=4323 Ack=1855 Win=61440 Len=0"
"8951","24.982218","13.201.244.85","10.0.0.159","TCP","60","[TCP Dup ACK 8950#1] 443  >  55901 [ACK] Seq=4323 Ack=1855 Win=61440 Len=0"
"8953","24.984654","13.201.244.85","10.0.0.159","TLSv1.3","341","Application Data"
"8954","24.984654","13.201.244.85","10.0.0.159","TLSv1.3","341","Application Data"
"8955","24.984719","10.0.0.159","13.201.244.85","TCP","54","55901  >  443 [ACK] Seq=1855 Ack=4897 Win=130816 Len=0"
"9188","26.603072","10.0.0.159","239.255.255.250","SSDP","143","M-SEARCH * HTTP/1.1 "
"9205","26.712131","10.0.0.1","10.0.0.159","UDP","477","57196  >  65355 Len=435"
"9213","26.783315","10.0.0.89","10.0.0.159","UDP","753","52566  >  65355 Len=711"
"9253","27.092215","10.0.0.159","142.250.82.213","STUN","162","Binding Request user: Ns1pmoW1ddaczgoKAAiKYigCIAEQ:V/VK"
"9257","27.118659","142.250.82.213","10.0.0.159","STUN","106","Binding Success Response XOR-MAPPED-ADDRESS: 69.248.132.39:63450"
"9278","27.274490","10.0.0.159","75.75.75.75","DNS","77","Standard query 0x09b6 AAAA beacons2.gvt2.com"
"9279","27.275035","10.0.0.159","75.75.75.75","DNS","77","Standard query 0x918f A beacons2.gvt2.com"
"9280","27.275517","10.0.0.159","75.75.75.75","DNS","77","Standard query 0xef86 HTTPS beacons2.gvt2.com"
"9284","27.300276","75.75.75.75","10.0.0.159","DNS","105","Standard query response 0x09b6 AAAA beacons2.gvt2.com AAAA 2800:3f0:4001:834::2003"
"9285","27.300968","75.75.75.75","10.0.0.159","DNS","93","Standard query response 0x918f A beacons2.gvt2.com A 142.250.206.227"
"9286","27.300968","75.75.75.75","10.0.0.159","DNS","134","Standard query response 0xef86 HTTPS beacons2.gvt2.com SOA ns1.google.com"
"9370","27.857347","10.0.0.159","34.237.73.95","TLSv1.2","293","Application Data"
"9377","27.893737","34.237.73.95","10.0.0.159","TCP","60","443  >  51102 [ACK] Seq=289 Ack=507 Win=404 Len=0"
"9378","27.894131","34.237.73.95","10.0.0.159","TLSv1.2","317","Application Data"
"9391","27.934312","10.0.0.159","34.237.73.95","TCP","54","51102  >  443 [ACK] Seq=507 Ack=552 Win=512 Len=0"
"9517","28.864901","10.0.0.159","75.75.75.75","DNS","68","Standard query 0xd24c AAAA b.6sc.co"
"9518","28.865445","10.0.0.159","75.75.75.75","DNS","68","Standard query 0x46e7 A b.6sc.co"
"9519","28.865943","10.0.0.159","75.75.75.75","DNS","68","Standard query 0x9cf0 HTTPS b.6sc.co"
"9525","28.892202","75.75.75.75","10.0.0.159","DNS","199","Standard query response 0xd24c AAAA b.6sc.co CNAME b2.6sc.co.edgekey.net CNAME e212585.b.akamaiedge.net SOA n0b.akamaiedge.net"
"9527","28.894991","75.75.75.75","10.0.0.159","DNS","170","Standard query response 0x46e7 A b.6sc.co CNAME b2.6sc.co.edgekey.net CNAME e212585.b.akamaiedge.net A 23.196.3.196 A 23.196.3.174"
"9528","28.896058","75.75.75.75","10.0.0.159","DNS","199","Standard query response 0x9cf0 HTTPS b.6sc.co CNAME b2.6sc.co.edgekey.net CNAME e212585.b.akamaiedge.net SOA n0b.akamaiedge.net"
"9529","28.896948","10.0.0.159","23.196.3.196","TCP","66","55907  >  443 [SYN] Seq=0 Win=64240 Len=0 MSS=1460 WS=256 SACK_PERM"
"9533","28.915039","23.196.3.196","10.0.0.159","TCP","66","443  >  55907 [SYN, ACK] Seq=0 Ack=1 Win=64240 Len=0 MSS=1460 SACK_PERM WS=128"
"9534","28.915174","10.0.0.159","23.196.3.196","TCP","54","55907  >  443 [ACK] Seq=1 Ack=1 Win=131328 Len=0"
"9535","28.916256","10.0.0.159","23.196.3.196","TCP","1514","55907  >  443 [ACK] Seq=1 Ack=1 Win=131328 Len=1460 [TCP segment of a reassembled PDU]"
"9536","28.916256","10.0.0.159","23.196.3.196","TLSv1.3","663","Client Hello (SNI=b.6sc.co)"
"9540","28.946455","23.196.3.196","10.0.0.159","TCP","60","443  >  55907 [ACK] Seq=1 Ack=2070 Win=63360 Len=0"
"9542","28.949674","23.196.3.196","10.0.0.159","TLSv1.3","318","Server Hello, Change Cipher Spec, Application Data, Application Data"
"9543","28.950528","10.0.0.159","23.196.3.196","TLSv1.3","134","Change Cipher Spec, Application Data"
"9544","28.950901","10.0.0.159","23.196.3.196","TLSv1.3","146","Application Data"
"9545","28.951233","10.0.0.159","23.196.3.196","TLSv1.3","1237","Application Data"
"9550","28.982951","23.196.3.196","10.0.0.159","TLSv1.3","325","Application Data"
"9551","28.987536","23.196.3.196","10.0.0.159","TCP","60","443  >  55907 [ACK] Seq=536 Ack=3425 Win=64128 Len=0"
"9552","28.988101","23.196.3.196","10.0.0.159","TLSv1.3","115","Application Data"
"9553","28.988175","10.0.0.159","23.196.3.196","TCP","54","55907  >  443 [ACK] Seq=3425 Ack=597 Win=130560 Len=0"
"9554","28.988481","10.0.0.159","23.196.3.196","TLSv1.3","85","Application Data"
"9555","28.988575","23.196.3.196","10.0.0.159","TLSv1.3","85","Application Data"
"9557","28.996265","23.196.3.196","10.0.0.159","TLSv1.3","281","Application Data"
"9558","28.996362","10.0.0.159","23.196.3.196","TCP","54","55907  >  443 [ACK] Seq=3456 Ack=855 Win=130304 Len=0"
"9559","28.998062","23.196.3.196","10.0.0.159","TLSv1.3","128","Application Data"
"9564","29.038232","10.0.0.159","23.196.3.196","TCP","54","55907  >  443 [ACK] Seq=3456 Ack=929 Win=130304 Len=0"
"9565","29.051270","23.196.3.196","10.0.0.159","TCP","60","443  >  55907 [ACK] Seq=929 Ack=3456 Win=64128 Len=0"
"9621","29.603786","10.0.0.159","239.255.255.250","SSDP","143","M-SEARCH * HTTP/1.1 "
"9623","29.608465","10.0.0.1","10.0.0.159","UDP","477","58878  >  65355 Len=435"
"9664","29.788866","10.0.0.89","10.0.0.159","UDP","753","47513  >  65355 Len=711"
"9944","31.012036","10.0.0.159","192.229.211.108","TCP","54","50497  >  80 [RST, ACK] Seq=2 Ack=1 Win=0 Len=0"
"10427","32.917782","10.0.0.159","13.201.244.85","TCP","54","55901  >  443 [FIN, ACK] Seq=1855 Ack=4897 Win=130816 Len=0"
"10436","32.920198","10.0.0.159","23.196.3.196","TCP","54","55907  >  443 [FIN, ACK] Seq=3456 Ack=929 Win=130304 Len=0"
"10459","32.980162","23.196.3.196","10.0.0.159","TLSv1.3","78","Application Data"
"10460","32.980225","10.0.0.159","23.196.3.196","TCP","54","55907  >  443 [RST, ACK] Seq=3457 Ack=953 Win=0 Len=0"
"10461","32.980650","23.196.3.196","10.0.0.159","TCP","60","443  >  55907 [FIN, ACK] Seq=953 Ack=3457 Win=64128 Len=0"
"10486","33.089350","10.0.0.159","18.164.124.4","TCP","66","55955  >  443 [SYN] Seq=0 Win=64240 Len=0 MSS=1460 WS=256 SACK_PERM"
"10491","33.109499","18.164.124.4","10.0.0.159","TCP","66","443  >  55955 [SYN, ACK] Seq=0 Ack=1 Win=65535 Len=0 MSS=1440 SACK_PERM WS=512"
"10492","33.110531","10.0.0.159","18.164.124.4","TCP","54","55955  >  443 [ACK] Seq=1 Ack=1 Win=132352 Len=0"
"10495","33.129008","10.0.0.159","18.164.124.4","TLSv1.2","302","Client Hello (SNI=beam.scs.splunk.com)"
"10500","33.154084","18.164.124.4","10.0.0.159","TCP","60","443  >  55955 [ACK] Seq=1 Ack=249 Win=67072 Len=0"
"10502","33.156915","18.164.124.4","10.0.0.159","TLSv1.2","1494","Server Hello"
"10503","33.156915","18.164.124.4","10.0.0.159","TCP","1494","443  >  55955 [ACK] Seq=1441 Ack=249 Win=67072 Len=1440 [TCP segment of a reassembled PDU]"
"10504","33.156981","10.0.0.159","18.164.124.4","TCP","54","55955  >  443 [ACK] Seq=249 Ack=2881 Win=132352 Len=0"
"10505","33.157244","18.164.124.4","10.0.0.159","TCP","1494","443  >  55955 [PSH, ACK] Seq=2881 Ack=249 Win=67072 Len=1440 [TCP segment of a reassembled PDU]"
"10506","33.157244","18.164.124.4","10.0.0.159","TLSv1.2","1151","Certificate, Server Key Exchange, Server Hello Done"
